{
  "schema_version": "5.0",
  "us": {
    "id": "US-024",
    "ref": "devflow/functional/user-stories/US-024-unified-actors-roster.md",
    "sources": [
      "devflow/discovery/DISC-001-aitl-and-subagent-orchestration.md",
      "devflow/discovery/DISC-002-devflow-agents-architecture.md",
      "devflow/adrs/ADR-007-devflow-agent-identity-model.md",
      "devflow/adrs/ADR-008-aitl-approval-precept.md",
      "devflow/functional/user-stories/US-001-team-roster.md",
      "devflow/functional/user-stories/US-022-actor-concept.md",
      "devflow/reviews/REV-001-hitl-checkpoint-role-inventory.md"
    ],
    "generation": {
      "created_at": "2026-08-23T12:58:16-03:00",
      "created_by": "human:eugenio.serrano",
      "runs": [
        {
          "tool": "opencode",
          "provider": "deepseek",
          "model": "deepseek-v4-flash",
          "tokens": {
            "input_uncached": null,
            "input_cached_read": null,
            "input_cache_write": null,
            "output": null
          },
          "agent": null
        }
      ],
      "duration_seconds": null
    },
    "review_ready_at": "2026-08-23T16:35:14-03:00",
    "review_started_at": "2026-08-23T17:37:00-03:00"
  },
  "story_points": 5,
  "bolts": [
    "devflow/functional/bolts/US-024.BOLT-001-roster-schema-and-validation.md",
    "devflow/functional/bolts/US-024.BOLT-002-aitl-enable-adr-template.md",
    "devflow/functional/bolts/US-024.BOLT-003-us001-absorption.md",
    "devflow/functional/bolts/US-024.BOLT-004-roster-as-enablement-reshape.md"
  ],
  "checkpoint_approvals": [
    {
      "checkpoint": "AITL-US-Approval",
      "subject": {
        "ref": "devflow/functional/user-stories/US-024-unified-actors-roster.md"
      },
      "decision": "approved",
      "decided_by": [
        {
          "actor": "human:eugenio.serrano",
          "role": "functional_analyst",
          "model": null
        }
      ],
      "decided_at": "2026-08-23T16:06:31-03:00",
      "comment": "Approved as Functional Analyst; story points confirmed at 5. The team-map reframe (who produces — derived from role, no per-agent field, reconciled with US-023) and the execution-order prerequisite (US-023.BOLT-001 delivers the role→artifacts mapping before the roster Bolts) verified. Authorizes decomposition into 3 candidate functional Bolts."
    },
    {
      "checkpoint": "AITL-US-Approval",
      "subject": {
        "ref": "devflow/functional/user-stories/US-024-unified-actors-roster.md"
      },
      "decision": "approved",
      "decided_by": [
        {
          "actor": "human:eugenio.serrano",
          "role": "functional_analyst",
          "model": null
        }
      ],
      "decided_at": "2026-08-23T17:37:47-03:00",
      "comment": "Re-approved (material change, G15 — the Modelo B revision): TEMPLATE-ACTOR + roster.schema.yaml + INDEX.md + project_policy file + README; one file per actor (naming N-rule); project-chosen names; reusable definitions (N actors : 1 definition); per-instance authoritative model (model-level independence between actors sharing a definition); production derived from role (no produces field). Prior approval (16:06:31) kept as history. Authorizes the re-synced decomposition."
    },
    {
      "checkpoint": "AITL-US-Approval",
      "subject": {
        "ref": "devflow/functional/user-stories/US-024-unified-actors-roster.md"
      },
      "decision": "approved",
      "decided_by": [
        {
          "actor": "human:eugenio.serrano",
          "role": "functional_analyst",
          "model": null
        }
      ],
      "decided_at": "2026-08-24T00:40:35-03:00",
      "comment": "Re-approved (revision 3, material change G15 — the roster-as-enablement model, ADR-014 accepted 2026-08-24): roster.yaml as the team-membership authority + examples/ subfolder + TEMPLATE-ACTOR simplified (capabilities deferred to v2); the schema-valid roster entry is the enablement (no per-project ADR, no policy switch); v1 schema rule + roster.yaml consistency check; TEMPLATE-AITL-ENABLE-ADR.md + project-policy.yaml retired; BOLT-004 (the kit reshape + the four MainAgents naming the mechanism inline) added. Prior approvals (16:06:31, 17:37:47) kept as history. Authorizes creating BOLT-004."
    }
  ]
}
