{
  "schema_version": "5.0",
  "us": {
    "id": "US-022",
    "ref": "devflow/functional/user-stories/US-022-actor-concept.md",
    "sources": [
      "devflow/discovery/DISC-001-aitl-and-subagent-orchestration.md",
      "devflow/discovery/DISC-002-devflow-agents-architecture.md",
      "devflow/adrs/ADR-007-devflow-agent-identity-model.md",
      "devflow/adrs/ADR-008-aitl-approval-precept.md",
      "devflow/adrs/ADR-010-actor-grammar-and-pure-v5-vocabulary.md",
      "devflow/functional/user-stories/US-016-kit-invariants-audit-tool.md"
    ],
    "generation": {
      "created_at": "2026-08-23T12:58:16-03:00",
      "created_by": "human:eugenio.serrano",
      "runs": [
        {
          "tool": "opencode",
          "provider": "deepseek",
          "model": "deepseek-v4-flash",
          "tokens": {
            "input_uncached": null,
            "input_cached_read": null,
            "input_cache_write": null,
            "output": null
          },
          "agent": null
        }
      ],
      "duration_seconds": null
    },
    "review_ready_at": "2026-08-23T13:10:00-03:00",
    "review_started_at": "2026-08-23T13:18:00-03:00"
  },
  "story_points": 5,
  "bolts": [
    "devflow/functional/bolts/US-022.BOLT-001-actor-concept-core.md",
    "devflow/functional/bolts/US-022.BOLT-002-actors-folder.md",
    "devflow/functional/bolts/US-022.BOLT-003-actor-vocabulary-and-agents-sweep.md"
  ],
  "checkpoint_approvals": [
    {
      "checkpoint": "AITL-US-Approval",
      "subject": {
        "ref": "devflow/functional/user-stories/US-022-actor-concept.md"
      },
      "decision": "approved",
      "decided_by": [
        {
          "actor": "human:eugenio.serrano",
          "role": "functional_analyst",
          "model": null
        }
      ],
      "decided_at": "2026-08-23T13:22:43-03:00",
      "comment": "Approved as Functional Analyst; story points confirmed at 5 (revised from 3 after the scope review). Incorporates the maintainer's actors/ folder decision (ADR-007 §3.5/§4 delegates the layout to this US) and the reviewer's five suggestions (SP, hard prerequisite, canonical mermaid home, AC split, non-signing actor). Authorizes decomposition into 3 candidate functional Bolts."
    },
    {
      "checkpoint": "AITL-US-Approval",
      "subject": {
        "ref": "devflow/functional/user-stories/US-022-actor-concept.md"
      },
      "decision": "approved",
      "decided_by": [
        {
          "actor": "human:eugenio.serrano",
          "role": "functional_analyst",
          "model": null
        }
      ],
      "decided_at": "2026-08-23T14:01:28-03:00",
      "comment": "Re-approved (material change, G15): Actor reframed as producer+approver — a team member who PRODUCES the governed artifacts its role owns (FA→US, architect→ADR, developer→SPEC+code, QA→TC/tests) in executor mode AND participates in AITL approvals in approver mode under the independence floor; no longer merely 'the participant who occupies a checkpoint pause'. Consistent with ADR-007 (modes:executor) and ADR-008 — no ADR change. Grammar/independence/open roles/safe-default/actors/ folder preserved; canonical mermaid replaced. First approval (13:22:43) kept as history. Bolts unchanged."
    }
  ]
}
