{
  "schema_version": "5.0",
  "us": {
    "id": "US-012",
    "ref": "devflow/functional/user-stories/US-012-invoices.md",
    "sources": [
      "devflow/analysis/glossary/glossary.md",
      "devflow/analysis/open-questions/OQ-003-invoices-pdf-format.md"
    ],
    "generation": {
      "created_at": "2026-08-02T09:00:00-03:00",
      "created_by": "human:fa.name",
      "runs": [
        {
          "tool": "opencode",
          "provider": "openrouter",
          "model": "anthropic/claude-sonnet-4.7",
          "tokens": {
            "input_uncached": 4100,
            "input_cached_read": 900,
            "input_cache_write": 0,
            "output": 780
          },
          "agent": null
        }
      ],
      "duration_seconds": 61
    },
    "review_ready_at": "2026-08-02T09:30:00-03:00",
    "review_started_at": "2026-08-02T09:45:00-03:00"
  },
  "story_points": 5,
  "bolts": [
    "devflow/functional/bolts/US-012.BOLT-003-invoice-download.md",
    "devflow/functional/bolts/US-012.BOLT-004-invoice-search.md"
  ],
  "checkpoint_approvals": [
    {
      "checkpoint": "AITL-US-Approval",
      "subject": {
        "ref": "devflow/functional/user-stories/US-012-invoices.md"
      },
      "decision": "approved",
      "decided_by": [
        {
          "actor": "human:fa.name",
          "role": "functional_analyst",
          "model": null
        }
      ],
      "decided_at": "2026-08-02T09:55:00-03:00",
      "comment": null
    }
  ]
}
