{
  "schema_version": "5.0",
  "us": {
    "id": "US-016",
    "ref": "devflow/functional/user-stories/US-016-kit-invariants-audit-tool.md",
    "sources": [
      "devflow/memory/MEM-260817-2123-agents-md-project-section.md",
      "devflow/memory/MEM-260823-0126-version-marker-sweep.md",
      "AGENTS.md"
    ],
    "generation": {
      "created_at": "2026-08-21T02:24:33-03:00",
      "created_by": "human:eugenio.serrano",
      "runs": [
        {
          "tool": "opencode",
          "provider": "deepseek",
          "model": "deepseek-v4-flash",
          "tokens": {
            "input_uncached": null,
            "input_cached_read": null,
            "input_cache_write": null,
            "output": null
          },
          "agent": null
        },
        {
          "tool": "claude-code",
          "provider": "anthropic",
          "model": "claude-opus-4-8",
          "tokens": {
            "input_uncached": null,
            "input_cached_read": null,
            "input_cache_write": null,
            "output": null
          },
          "agent": null
        }
      ],
      "duration_seconds": null
    },
    "review_ready_at": "2026-08-23T11:09:09-03:00",
    "review_started_at": "2026-08-23T11:13:43-03:00"
  },
  "story_points": 5,
  "bolts": [],
  "checkpoint_approvals": [
    {
      "checkpoint": "AITL-US-Approval",
      "subject": {
        "ref": "devflow/functional/user-stories/US-016-kit-invariants-audit-tool.md"
      },
      "decision": "approved",
      "decided_by": [
        { "actor": "human:eugenio.serrano", "role": "functional_analyst", "model": null }
      ],
      "decided_at": "2026-08-23T11:13:43-03:00",
      "comment": "Story points confirmed at 5. Encoding-hygiene (BOM/mojibake) invariant + bounded --fix mode accepted; input/ detect-only (G31) and never-auto-repair-mojibake confirmed. Decomposable into candidate functional Bolts."
    }
  ]
}
