{
  "schema_version": "5.0",
  "us": {
    "id": "US-017",
    "ref": "devflow/functional/user-stories/US-017-tooling-distribution-contract.md",
    "sources": [
      "distribution-kit/devflow/avenga-devflow/Avenga-DevFlow.md",
      "maintainer product direction (2026-08-21)"
    ],
    "generation": {
      "created_at": "2026-08-21T02:26:39-03:00",
      "created_by": "human:eugenio.serrano",
      "runs": [
        {
          "tool": "opencode",
          "provider": "deepseek",
          "model": "deepseek-v4-flash",
          "tokens": {
            "input_uncached": null,
            "input_cached_read": null,
            "input_cache_write": null,
            "output": null
          },
          "agent": null
        }
      ],
      "duration_seconds": null
    },
    "review_ready_at": null,
    "review_started_at": null
  },
  "story_points": 3,
  "bolts": [],
  "checkpoint_approvals": []
}
