{
  "schema_version": "5.0",
  "story_points": 5,
  "us": {
    "id": "US-013",
    "review_started_at": null,
    "sources": [
      "distribution-kit/devflow/reports/README.md",
      "tools/reporter/DESIGN.md",
      "maintainer product direction (2026-08-21)"
    ],
    "review_ready_at": null,
    "ref": "devflow/functional/user-stories/US-013-sprint-reports.md",
    "generation": {
      "created_at": "2026-08-21T01:32:43-03:00",
      "duration_seconds": null,
      "created_by": "human:eugenio.serrano",
      "runs": [
        {
          "provider": "deepseek",
          "model": "deepseek-v4-flash",
          "tool": "opencode",
          "tokens": {
            "output": null,
            "input_cache_write": null,
            "input_uncached": null,
            "input_cached_read": null
          },
          "agent": null
        }
      ]
    }
  },
  "bolts": [],
  "checkpoint_approvals": []
}
