{
  "schema_version": "5.0",
  "us": {
    "id": "US-019",
    "ref": "devflow/functional/user-stories/US-019-operationalize-units-family.md",
    "sources": [
      "devflow/functional/user-stories/US-015-unit-governance.md",
      "devflow/adversarial-reviews/AREV-002-single-operator-sweep/03-VERDICT.md",
      "maintainer product direction (2026-08-22) — US-015 part (b) transfer on US split"
    ],
    "generation": {
      "created_at": "2026-08-22T13:32:33-03:00",
      "created_by": "human:eugenio.serrano",
      "runs": [
        {
          "tool": "opencode",
          "provider": "deepseek",
          "model": "deepseek-v4-flash",
          "tokens": {
            "input_uncached": null,
            "input_cached_read": null,
            "input_cache_write": null,
            "output": null
          },
          "agent": null
        }
      ],
      "duration_seconds": null
    },
    "review_ready_at": null,
    "review_started_at": null
  },
  "story_points": 5,
  "bolts": [],
  "checkpoint_approvals": []
}
