{
  "schema_version": "5.0",
  "us": {
    "id": "US-020",
    "ref": "devflow/functional/user-stories/US-020-manifest-aitl-evolution.md",
    "sources": [
      "devflow/discovery/DISC-002-devflow-agents-architecture.md",
      "devflow/discovery/DISC-001-aitl-and-subagent-orchestration.md",
      "devflow/adrs/ADR-008-aitl-approval-precept.md"
    ],
    "generation": {
      "created_at": "2026-08-22T14:39:46-03:00",
      "created_by": "human:eugenio.serrano",
      "runs": [
        {
          "tool": "claude-code",
          "provider": "anthropic",
          "model": "claude-opus-4-8",
          "tokens": {
            "input_uncached": null,
            "input_cached_read": null,
            "input_cache_write": null,
            "output": null
          },
          "agent": null
        }
      ],
      "duration_seconds": null
    },
    "review_ready_at": "2026-08-22T14:39:46-03:00",
    "review_started_at": "2026-08-22T15:38:08-03:00"
  },
  "story_points": 5,
  "bolts": [
    "devflow/functional/bolts/US-020.BOLT-001-manifest-schemas-v5.md",
    "devflow/functional/bolts/US-020.BOLT-002-manifest-text-and-agents.md",
    "devflow/functional/bolts/US-020.BOLT-003-manifest-migration-path.md",
    "devflow/functional/bolts/US-020.BOLT-004-manifest-v5-propagation-sweep.md"
  ],
  "checkpoint_approvals": [
    {
      "checkpoint": "AITL-US-Approval",
      "subject": {
        "ref": "devflow/functional/user-stories/US-020-manifest-aitl-evolution.md"
      },
      "decision": "approved",
      "decided_by": [
        {
          "actor": "human:eugenio.serrano",
          "role": "functional_analyst",
          "model": null
        }
      ],
      "decided_at": "2026-08-22T15:38:08-03:00",
      "comment": "story_points 5 confirmed. v5.0 manifest evolution (checkpoint_approvals[] + actor/mode + schema_version 5.0) plus its describing text (§3.12, G23, four kit agents, §5.16 conversion). HITL->AITL rename is a separate US. Authorizes decomposition into candidate functional Bolts."
    }
  ]
}
